subject,content
엔비디아 실적과 9월 고용…헤비급 원투 펀치[뉴욕증시-주간전망],"(뉴욕=연합뉴스) 진정호 연합인포맥스 특파원 = 이번 주 뉴욕증시는 기업 실적과 경기지표 측면에서 중대한 재료가 하나씩 나온다. 인공지능(AI) 산업의 총아 엔비디아의 3분기 실적과 미국 연방 정부 셧다운(일시 업무 정지)로 지연됐던 9월 비농업 고용보고서다.    *그림*   



젠슨 황 엔비디아 최고경영자[연합뉴스 자료사진]    엔비디아는 오는 19일(현지시간) 증시 마감 후 3분기 실적을 발표한다. 최근 AI 거품론과 AI 칩 감가상각 논란이 시장을 점령하고 있는 아슬아슬한 시기에 엔비디아는 성적표를 공개하게 됐다.    엔비디아의 3분기 실적 자체는 이번에도 시장의 예상을 웃돌 가능성이 크다. 최근 몇 달간 쏟아진 대규모 제휴와 신규 계약만 고려해도 시장 추정치를 뛰어넘을 것이라는 데는 그다지 의심이 들지 않는다. AI 열풍이 시작되고 그랬듯 이번에도 예상치를 웃도는 게 문제가 아니라 '얼마나 웃도느냐'가 문제다.    하지만 이번 실적 발표에선 3분기 실적과 4분기, 내년 실적 전망보다 그래픽처리장치(GPU)의 감가상각 방식이 더 화두가 될 가능성이 있다. AI 칩의 실제 가용 연한을 두고 갑론을박이 벌어지는 만큼 분석가들은 콘퍼런스콜에서 감가상각에 대한 엔비디아의 입장을 '추궁'할 가능성이 크다.    AI 칩의 내용연수와 감가상각 방식은 기업들의 일반적인 감가상각 문제와 결이 다르다. AI 열풍의 한가운데에 엔비디아의 GPU가 있고 여기에 들어가는 비용을 기준으로 하이퍼스케일러들이 실적을 추산하기 때문에 AI 칩의 감가상각은 이들의 실적과 주가, 회사채, 대출 금리까지 영향을 미치는 핵심 요인이다.    현재 하이퍼스케일러들은 엔비디아 AI칩의 내용연수를 5~6년으로 잡고 있지만 이에 대한 의구심도 상당하다. 마이크로소프트(MS)는 자사 컴퓨팅 장비의 내용연수를 2~6년으로 제시했는데 실제 2~3년에 불과하다면 AI 인프라 구축에 투입되는 비용은 모두 뒤집혀야 한다. 이는 나아가 AI 산업이 지금 형태로 유지될 수 있느냐는 문제로 번질 수도 있다.    펀드스트랫의 하디카 싱 전략가는 ""엔비디아가 기술주의 전반적인 무기력 흐름을 반전시킬 수 있을지 주목된다""며 ""지난 몇 주 동안 부진했던 기술주 랠리를 되살릴 수 있을지가 관건""이라고 말했다.    페이브파이낸스의 피터 코리 최고시장전략가는 ""개별 뉴스만 보면 그리 위협적으로 보이지 않지만 이것들이 누적될 경우 시장에 결국 영향을 미칠 것""이라고 지적했다.    20일에 공개되는 9월 비농업 고용지표는 미국 연방준비제도(Fed·연준)의 금리 경로에 중요한 변곡점이 될 수 있다. 주요 연준 인사가 잇달아 매파적 발언을 쏟아내면서 12월 금리 동결 베팅이 50%를 웃돌고 있기 때문이다.    지난 9월과 10월 연준이 기준금리를 잇달아 25bp씩 인하했을 때의 근거는 고용 둔화의 예방이었다. 골드만삭스는 9월 신규 고용이 8만5천개로 예상했는데 이는 8월의 2만2천개보다 크게 늘어난 수치다.    고용 둔화세가 완만해지는 모습을 보이면 다시 인플레이션으로 시선이 쏠릴 가능성이 크다. 베스 해맥 미국 클리블랜드 연방준비은행 총재를 비롯한 매파 인사들은 물가상승률이 여전히 너무 높다며 12월 금리인하가 불필요하다는 입장을 거듭 설파하고 있다.    최근 연준 인사들의 발언을 보면 12월에도 금리를 내려야 한다고 뚜렷하게 주장하는 인사는 연준 이사들인 미셸 보먼, 크리스토퍼 월러, 스티븐 마이런 정도에 불과하다. 나머지 인사들은 중립적이거나 매파적 성향을 드러내고 있다.    금리인하를 이끌어 내려면 제롬 파월 연준 의장이 반대파를 잘 구슬려야 하지만 내년 5월 퇴임을 앞두고 파월이 힘을 쓸 수 있을지 의문이다. 12월 회의에서 반대파가 여럿 나온 채로 금리가 결정되면 '분열된 연준'은 파월 후임 의장 시대에 '뉴노멀'이 될 수 있다. 파월의 후임은 도널드 트럼프 미국 대통령의 구미에 맞는 인물이 맡을 것으로 예상되기 때문이다.주요 일정 및 연설     - 11월 17일    존 윌리엄스 뉴욕 연방준비은행(연은) 총재 연설    필립 제퍼슨 미국 연방준비제도(연준·Fed) 부의장 연설    닐 카시카리 미니애폴리스 연은 총재 연설    크리스토퍼 월러 연준 이사 연설- 11월 18일    10월 산업생산*    11월 미국주택건설업협회(NAHB) 주택 시장지수(HMI)    마이클 바 연준 이사 연설    기업 실적 : 홈디포- 11월 19일    10월 주택착공*    연방공개시장위원회(FOMC) 의사록    존 윌리엄스 뉴욕 연은 총재 연설    기업 실적 : 엔비디아, 타깃- 11월 20일    9월 비농업 고용보고서    주간 신규 실업수당 청구건수*    10월 기존주택판매    베스 해맥 클리블랜드 연은 총재 연설    리사 쿡 연준 이사 연설    오스탄 굴스비 시카고 연은 총재 연설- 11월 21일    11월 S&P 글로벌 제조업 및 서비스업 PMI    11월 미시간대 소비심리지수·기대 인플레이션       존 윌리엄스 뉴욕 연은 총재 연설    마이클 바 연준 이사 연설    필립 제퍼슨 연준 부의장 연설    로리 로건 댈러스 연은 총재 연설별표(*)는 셧다운 해제에도 발표 일정 미정    jhjin@yna.co.kr"
IMA·발행어음이 여는 100조 '모험자본'…증권사 역할 커진다,"NH는 IMA, 삼성·하나·메리츠·신한 발행어음 인가 대기 중증권사 자기자본 300%까지 활용…성장·기술 기반 기업에 투자



한국투자증권(왼쪽)과 미래에셋증권 본사 (각 사 제공)(서울=뉴스1) 손엄지 기자 = 증권업계가 '모험자본 시대'의 핵심 플레이어로 빠르게 부상하고 있다. 미래에셋증권(006800)과 한국투자증권이 종합투자계좌(IMA) 1호 사업자로 지정될 가능성이 커졌고, 키움증권(039490)이 국내 5호 발행어음(단기금융업) 사업자가 될 채비를 마치면서 초대형 투자은행(IB) 중심 기업금융 자금 공급력이 급격히 확대되는 모습이다.16일 금융투자업계에 따르면 NH투자증권(005940)은 IMA 사업자 지정을 위해 현장 실사를 준비 중이고, 삼성증권·하나증권·메리츠증권·신한투자증권 역시 발행어음 인가를 위한 심사를 받고 있다.금융당국이 '모험자본 공급 확대'를 위해 종합금융투자사업자(종투사) 지정에 속도를 내겠다는 입장을 밝힌 만큼 자본시장을 통한 기업금융 구조가 연내 대전환을 맞을 수 있다는 전망이 나온다.100조 모험자본 시장, 연내 열리나IMA는 증권사가 고객 자금을 모아 기업대출·회사채·프로젝트파이낸싱(PF)에 투자해 원금 보장 수익률을 제공하는 상품이다. 자기자본의 최대 300%까지 자금 조달할 수 있어 시장에서는 사실상 '예금의 대체재이자 기업금융 파이프라인'으로 보고 있다.발행어음 역시 자기자본의 200%까지 자금 조달이 가능해 IMA와 발행어음 인가를 받은 증권사의 자기자본 규모를 고려했을 때 연내 100조 원에 육박하는 자금이 기업금융·모험자본에 풀릴 수 있다. 특히 금융당국이 IMA 운용자산의 70% 이상을 기업금융 자산으로 구성하도록 하고, 발행어음 조달액의 25% 이상을 모험자본에 의무적으로 투입하도록 규제를 강화하면서 조달된 자금 상당수가 실제 성장 기업으로 흐를 가능성이 커졌다.개인투자자도 손실 걱정 없이 모험투자개인투자자에게도 변화는 크다. 기존에는 손실 가능성이 높고 진입 장벽이 있어 접근하기 어려웠던 모험자본 투자를 IMA·발행어음 구조를 통해 '원금 보장 기반'으로 경험할 수 있게 된다.증권사가 자체 신용으로 원금과 약정 수익을 보전해 주는 만큼 예금과 유사한 안정성 속에서 기업금융 수익률을 공유할 수 있다. 물론 예금자보호법 적용을 받지 않기 때문에 증권사가 부실화될 경우 투자 손실 가능성이 존재한다.증권사의 모험자본은 국내 인공지능(AI) 반도체, 데이터센터·전력 인프라 등 AI 기반 산업과 함께 혁신 기술을 보유한 기업에 다양한 방식으로 투자될 것으로 보인다.한 금융투자업계 관계자는 ""프로젝트 파이낸싱(PF) 중심이던 증권사 자금 흐름이 성장·기술 기반 산업으로 이동하는 것은 국내 자본시장 체질을 바꾸는 결정적 변화""라며 ""금리 인하 국면과 초대형 IB의 조달 능력 확대가 맞물리면서 한국 자본시장이 본격적인 '모험자본 르네상스'를 맞이할 수 있다""고 말했다."
"중국에 뒤처진 K-조선, 트럼프 구애에 '우뚝'[MAGA發 K-스톡랠리]④","한미 조선 협력, 해군 함정 건조까지 확대…""핵잠 건조 승인""""미국 중심 전략산업 밸류체인 편입…전략산업으로 육성해야""[편집자주] ""Make America Great Again(미국을 다시 위대하게)"" 도널드 트럼프 미국 대통령의 '마가(MAGA)'의 꿈이 K-증시 경쟁력을 키우고 있다. 기술 경쟁력과 생산 인프라를 갖춘 한국 기업이 미국의 'MAGA 파트너'로 부각되고 있기 때문이다. MAGA발(發) 증시 호황의 기회와 위기를 조명해본다



이재명 대통령이 14일 서울 용산 대통령실 청사에서 한·미 팩트시트 타결 결과를 발표하고 있다. 왼쪽부터 김용범 정책실장, 이 대통령, 위성락 국가안보실장, 이규연 홍보소통수석. (대통령실 제공. 재판매 및 DB 금지) 2025.11.14/뉴스1 ⓒ News1 허경 기자 (서울=뉴스1) 손엄지 기자 = ""미국 조선업이 한국의 도움과 협력을 필요로 한다.""지난해 11월 당선 후 한미 정상 간 첫 통화에서 트럼프 대통령은 '한국의 조선업'을 콕 집어 언급했다. 중국의 추격에 위상이 흔들리고 있는 'K-조선'에 기회의 문이 열렸다. 트럼프 대통령의 '미국을 다시 위대하게'(MAGA) 기조가 조선·해군력으로 확장되면서 한국 조선업의 중요성이 커지고 있다. 미국이 중국의 해양력 확장을 막기 위해 조선·해군 투자를 늘리고 있지만, 자국 조선소만으로는 필요한 물량을 감당할 수 없는 상황이다. 결국 기술력과 생산 인프라를 갖춘 한국 조선업에 시선이 돌아가면서 한국 기업들이 'MAGA 동맹'의 또 다른 중심축으로 떠올랐다.16일 한국거래소에 따르면 지난 14일 기준 'KRX K조선 TOP10 지수'는 최근 한 달간 14% 올랐다. 같은기간 코스피 상승률(12.6%)보다 1.4%포인트(p) 더 높다.지난 14일 이재명 대통령이 발표한 '팩트시트'에 한미 조선 협력이 해군 함정 건조 협력으로 확대된다는 내용이 담기면서 조선업은 다시 주목받고 있다.""한국 조선업, 중국 제외하면 압도적 기술력 갖춰""미국의 해군력 증강은 단순한 '함정 발주 확대'에 그치지 않는다. 군수지원함, 수송선, 상륙함, 정비조선 등 해군·해병 전력 전반이 대상이다. 14일 미국은 한국의 핵추진 잠수함 건조 계획도 승인했다.선체 제작만이 아니라 전투체계, 레이더·센서, 통신장비, 추진·전력 시스템까지 밸류체인이 길게 이어져 있어 방산·원전·전력기기 산업에도 동시에 기회가 열린다.한국 기업들이 이미 액화천가스(LNG)선, 초대형 컨테이너선, 군함·잠수함, 발전용 터빈까지 세계 상위권 경쟁력을 갖추고 있다는 점도 미국에서 주목하는 지점이다.김영일 대신증권 리서치센터장은 ""미중 기술·군사력 패권 갈등이 심화되면 반도체와 방산·조선의 수혜가 예상된다""며 ""조선업의 경우 중국을 제외하면 타국 대비 기술력 격차가 존재한다""고 말했다.K-조선株 올해 141% 급등…조선 ETF 순자산 1위국내 주식시장에서도 조선업종 수혜 기대감은 커지고 있다. KRX K조선 TOP10 지수는 올해 들어 141% 넘게 급등했고, 'SOL 조선TOP3플러스'는 순자산(AUM)이 2조 원을 넘기면서 테마형 ETF 중 가장 큰 규모로 성장했다.전문가들은 이번 조선·방산 호황이 과거 '차·화·정'처럼 특정 국가 성장에 기대던 사이클과는 다르다고 진단한다. 미국 중심 전략산업 밸류체인 편입이라는 구조적 흐름으로 보고 있다.유종우 한국투자증권 리서치센터장은 ""조선·방산·원전 등은 이미 글로벌 밸류체인 전반에서 한국 기업들의 경쟁력이 입증된 분야""라며 ""미국 시장 진출은 향후 다른 국가로의 확장에도 영향을 줄 수 있다""고 말했다.다만 기업들의 경쟁력만으로는 성장 기회를 온전히 흡수하기 어렵다는 지적도 나온다. 규제 완화, 보조금 지급, 세제 지원 등 정부 차원의 전략 산업 육성을 병행해야 한다는 것이다.윤석모 삼성증권 리서치센터장은 ""한국 기업들은 미국 조선업과의 협력을 통해 새로운 사업 기회를 얻을 수 있지만, 현지 인건비 부담과 공공자금이 결합한 사업 특성상 수익성이 제한될 수 있다""고 전망했다."
"AI 열풍, 엔비디아 이익 얼마나 늘렸을까[주간증시전망]","20일 새벽 엔비디아 실적 발표10월 FOMC 회의록에도 주목        인공지능(AI) 고평가 논란과 미국의 금리 인하 전망이 글로벌 주식 시장을 흔들고 있다. 이번주(11월 17~21일)는 이 두 가지가 향후 증시에 어떤 영향을 줄지 확인하는 분기점이 될 전망이다.우선 한국 시각으로 20일 새벽, 엔비디아의 실적 발표가 예정돼 있다. 최근 AI 관련주가 고평가됐다는 버블론이 불거지며 미국 기술주도 조정을 받았다. 엔비디아의 주가 또한 고점 대비 약 15%의 조정을 받은 바 있다.



젠슨 황 엔비디아 최고경영자(CEO)가 30일 서울 강남구 코엑스에서 열린 엔비디아 지포스 게이머 페스티벌에 참석해 인사말을 하고 있다. /뉴스1        이런 시점에 엔비디아의 실적과 젠슨 황 엔비디아 최고경영자(CEO)의 입장은 향후 시장 방향을 결정할 분기점이 될 것으로 보인다. 시티은행은 엔비디아의 최근 분기 매출액이 568억달러(한화 약 83조원)를 기록할 것이라 전망했다. 이는 시장 전망치인 546억달러(한화 약 80조원)를 상회하는 것이다.나정환 NH투자증권 연구원은 “시장의 관심은 실적 서프라이즈 자체보다 마진 개선과 매출 성장률에 집중될 전망”이라며 “황 CEO가 데이터센터 매출 전망이나 AI 버블 논란에 대해 어떤 입장을 밝히는지도 주가에 중요한 변수로 작용할 것”이라 분석했다.같은 날, 미국 10월 연방공개시장위원회(FOMC) 회의록 공개에도 주목해야 한다. 오는 12월 연준의 통화정책 결정 회의가 예정된 가운데 금리 인하에 대한 불확실성이 점차 커지는 상황이기 때문이다.연준 내부의 의견 분열이 커지며 통화 정책에 대한 방향성이 불투명해졌다는 이야기가 나온다. 제롬 파월 연준 의장은 최근 “12월 금리 인하는 확정된 것이 아니다”라고 발언했다. 연준 위원들도 기준금리를 현 수준에서 동결해야 한다는 발언을 공개적으로 이어가고 있다.특히 미국 셧다운(일시적 업무정지) 사태로 인해 미국 경제지표 발표 누락이 예상되는 상황이라 연준 위원들의 의견 확인이 중요해질 전망이다.정해창 대신증권 연구원은 “회의록을 통해 내부 의견 차이 여부와 격차를 확인할 수 있을 것“이라며 “셧다운 사태로 10월 경제지표 발표 누락이 예상돼 주요 데이터 없이 정책 결정이 이뤄질 수 있는 상황에서 연준 위원들의 생각과 판단이 더욱 중요해질 전망”이라고 설명했다.국회 주도의 정책 모멘텀(상승 동력)에도 관심을 기울여야 한다. 세제개편안 관련 논의가 본격화되고 있는 데다 이번 주 중 여당의 코스피 5000특별위원회 차원의 3차 상법 개정안이 발의될 예정이다. 이 개정안에는 기존에 보유하고 있던 자사주까지 1년 내 소각하도록 하는 내용이 담길 것으로 예상된다.국내 증시에서 자사주가 많은 금융주와 지주사를 중심으로 정책 기대감이 커질 것으로 보인다. 또 배당소득 분리과세 최고세율이 25%로 잠정 결정됐고 연말 배당 시즌이 다가오는 만큼 배당주에도 관심이 몰릴 전망이다.오는 18일에는 유아 콘텐츠 기업 더핑크퐁컴퍼니가 코스닥 시장에 상장할 예정이다. 더핑크퐁컴퍼니는 일반 투자자 대상 공모주 청약에서 846.9대 1의 경쟁률을 기록했다. 최종 공모가는 희망 공모가 범위 상단인 3만8000원으로 확정됐다.한편 지난주는 반등했던 코스피 지수가 상승폭을 반납하며 마무리됐다. 지난 11일, 코스피 지수는 5거래일 만에 4100선에 복귀한 후 3거래일 동안 상승세를 이어갔다. 하지만 지난 14일 하루 동안에만 3.81%(159.06포인트) 하락하며 4011.57로 장을 마쳤다.미국 증시에서 AI 고평가 논란이 재점화된 영향이 컸다. 그동안 시장을 이끌어온 삼성전자와 SK하이닉스 등 반도체 대형주들이 직격탄을 맞았다."
"엔비디아가 투자했다던 이 회사, 주가 왜 이래?… 한달만에 40%↓ ‘날개 없는 추락’ [투자360]","코어위브 주가 11월 37.98% 하락오라클·코어위브 신용부도스와프(CDS) 프리미엄 확대에 비상등



[로이터][헤럴드경제=신주희 기자] 미국의 클라우드 기업 코어위브가 한달 새 주가가 40% 하락하며 날개 없는 추락을 보여주고 있다.한때 미국의 인공지능(AI) 반도체 기업 엔비디아가 투자한 회사로 기대를 모으면서 주가가 183달러까지 치솟았지만 현재는 78.3달러로 반토막이 나기 직전이다.16일 투자업계에 따르면 코어위브의 주가는 이달 들어 37.98% 하락했다. 지난 3일(현지시간) 126.32달러였던 주가는 78.34달러로 급락했다. 시장 예상치를 웃도는 3분기 실적을 발표했지만 매출 전망치를 하향 조정한 게 화근이 됐다.코어위브가 밝힌 3분기 매출은 13억6000만달러, 주당 손실은 22센트로, 시장 전망치였던 매출 12억9000만달러에 주당 손실 51센트를 웃돈 수준이었다.문제는 매출 전망치였다. 코어위브는 데이터센터 파트너의 일정 지연에 따른 영향으로 매출 전망치를 조정한다며 50억5000만~51억5000만달러로 제시했다. 종전 전망치인 51억5000만~53억5000만달러보다 하향됐다.이밖에도 오라클, 아이렌 등도 주가에 파란불이 켜졌다. 오라클의 주가는 지난 한 달간 27.23% 하락했다. 투자업계에서는 이들 기업의 신용부도스와프(CDS) 프리미엄에 촉각을 곤두 세우고 있다. 최근 AI관련주가 가운데에서도 CDS프리미엄이 확대된 기업의 낙폭이 커졌다는 분석이다.코어위브의 채무 불이행(디폴트)에 대비하는 신용부도스와프(CDS) 비용이 급등하고 있다. 블룸버그에 따르면 코어위브 5년물 CDS 가격은 10월 초 이후 53% 넘게 뛰었다. 코어위브뿐만 아니라 오라클에서도 유사한 분위기가 감지되고 있다.CDS는 기업 부도 위험에 대비하는 보험 역학로 기업이 채권 원리금을 갚지 못할 경우 보험금이 지급된다. 가격 상승은 시장이 더 높은 디폴트 위험을 반영하고 있다는 의미다.코어위브 주가 하락과 CDS 수요 증가는 맞물려 있다고 투자 리서치 업체 베어트랩스 리포트는 지난 12일 수요일 보고서에서 지적했다. 데이터센터 구축을 위해 상당한 부채를 지고 있으며 주가가 하락할수록 부채와 마이너스 현금흐름이 기업가치에서 차지하는 비중도 커진다.지난 2분기 291% 수준이던 코어위브의 부채 비율은 3분기 363%로 다시 급등했다. 유동비율도 악화됐다. 지난해 4분기에 이어 1~2분기 상승했던 유동비율은 3분기 다시 50% 아래로 하락했다.조만주 키움증권 연구원은 “과도하게 높아진 수요로 시설 램프업이 지연되면서 매출 인식도 늦어지고, 이로 인한 단기 실적 부담이 가장 큰 리스크로 떠올랐다”고 말했다. 그는 “다만 회사 측은 주요 고객들이 이미 CAPEX 지연을 인지하고 동의한 상태이며, 백로그 취소도 없다고 밝혔다”며 “현재 계약 물량은 내년 1분기 데이터센터 준공과 동시에 즉시 반영될 예정”이라고 설명했다.그러면서 “예상치 못한 실행력 차질이 가장 큰 변동성 리스크로 유입된 만큼 추후 램프업(가동률 확대)에 대한 정상화 신호가 주가 반등의 키로 작용할 것이며 결국 내년 1 분기까지는 지속적인 모니터링이 필요할 것으로 판단한다”고 덧붙였다."
