subject,content
'서학개미'가 강달러 주범이라고?…해외주식 순매수 5조 원 돌파[마켓시그널],"이달 해외주식 순매수 5.3조원추세대로면 월최대치 경신 가능성美증시 투자자들이 순매수 주도외환당국, 구두·미세 개입 나서전문가 “환율 추가 상승 제한적”



코스피가 뉴욕증시 급락 여파로 3% 이상 하락한 14일 서울 중구 하나은행 본점 딜링룸 현황판에 코스피 지수가 표시돼 있다. 이날 코스피지수는 159.06포인트(3.81%) 내린 4011.57에, 코스닥지수는 20.47포인트(2.23%) 내린 897.90에 장을 마감했다. 연합뉴스[서울경제] 이달 들어 국내 개인 투자자들의 해외 주식 순매수 규모가 벌써 5조 원을 돌파했다. 전문가들은 최근 환율 급등 주요 원인이 이들의 공격적 투자에 기인했다고 분석하면서도 추가적인 환율 상승 가능성은 제한적이라고 내다봤다.16일 한국예탁결제원과 국제금융센터에 따르면 이달 1~14일 국내 개인 투자자는 해외 주식을 총 36억 3000만 달러(약 5조 3000억원) 순매수한 것으로 집계됐다. 이 같은 추세가 이어진다면 월별 역대 최대 규모를 기록한 지난달(68억 1300만 달러) 해외 주식 순매수액을 이달 넘어설 것으로 전망된다. 지난달 1~14일 국내 개인 투자자 해외 주식 순매수 규모는 17억 7200만 달러 수준으로, 이달 같은 기간의 절반에도 미치지 못했다.해외주식 투자는 서학개미(미국 증시에 투자하는 국내 투자자)들이 주도했다. 국내 투자자들은 미국 주식을 36억 3천400만달러어치 순매수했다. 기술주를 중심으로 한 나스닥지수 등 미국 주요 주가지수가 이달 들어 하락세로 돌아선 가운데 대거 ‘물타기’에 나선 결과로 보인다.반면 유로 지역 주식 1억 8000만달러, 홍콩 주식 1억 7000만 달러, 중국 주식 1억 5000만 달러 등 다른 지역의 순매수액은 상대적으로 미미했다. 일본 주식은 오히려 3억 5000만 달러 순매도를 기록했다.개인 투자자들의 투자 성향은 매우 공격적인 것으로 평가된다. 이달 들어 14일까지 서학개미들이 가장 많이 사들인 해외 주식은 메타로 순매수액은 무려 5억 6000만 달러(약 8000억 원)에 달한다. 지난달 29일만 해도 750달러대였던 메타 주식이 이달 600달러 선을 위협받을 정도로 단기 폭락하자 대규모 매수로 대응한 모양새다. 엔비디아(5억 4300만 달러)에 이어 메타 주가 흐름에 2배로 연동되는 레버리지 상장지수펀드(ETF·METU)에도 2억 7100만 달러 순매수가 몰렸다.최근 국내 개인 투자자들의 해외 주식 순매수는 외국인 투자자들의 국내 주식 순매도와 동시에 확대되는 흐름이어서 더욱 주목된다. 한국거래소에 따르면, 외국인 투자자들은 이달 들어 14일까지 유가증권시장에서 대규모 차익실현에 나서 누적 9조 1278억 원어치를 순매도했다.



14일 서울 종로구 정부서울청사에서 열린 시장상황점검회의 시작에 앞서 이찬진(왼쪽부터) 금융감독원장, 이창용 한국은행 총재, 구윤철 부총리 겸 기획재정부 장관, 이억원 금융위원장이 기념 촬영하고 있다. 사진제공=기획재정부━이창용 “국내 거주자의 해외 투자에 최근 환율 좌우”즉, 개인들의 달러 매수 수요와 외국인의 원화 매도 수요가 원화 가치 하락 압력을 높인 것으로 볼 수 있다. 올 1~9월 국내 법인과 금융기관 등을 포함하는 전체 내국인의 해외 주식 순매수 규모는 누적 718억 4200만 달러에 달해 같은 기간 사상 최대를 기록한 경상수지 흑자(827억 7000만 달러) 효과를 상당 부분 상쇄한 것으로 분석되기도 했다. 이창용 한국은행 총재는 이달 12일 언론 인터뷰에서 “최근 환율 움직임은 대부분 국내 거주자의 해외 투자에 좌우됐다”고 진단했다.━외환당국 본격 개입…“환율 추가 상승은 제한적”다만, 전문가들은 우리 외환당국이 환율 관리에 나서면서 당분간 환율 추가 상승 가능성은 제한적이라고 내다봤다. 서울 외환시장에 따르면 14일 달러·원 환율은 전 거래일 종가 대비 10.7원 내린 1457원으로 마감했다. 구윤철 부총리 겸 기획재정부 장관의 환율 상승에 대해 구두 개입성 발언 영향이었다. 외환당국의 스무딩 오퍼레이션(미세조정)으로 추정되는 움직임도 동시에 관측됐다.민경원 우리은행 연구원은 “환율 변동성을 줄이기 위한 외환당국의 미세조정 개입 및 수출업체의 고점매도 물량 경계감은 환율 상승폭을 축소할 전망”이라며 “외환시장에서 이탈한 수출업체 및 중공업체의 복귀 여부도 주목해 볼 만한 사항”이라고 분석했다. 문다운 한국투자증권 연구원은 “이미 달러 강세폭이나 주요국 통화 약세폭 대비 원화 약세 압력이 누적된만큼 상단에 근접할수록 레벨 부담과 함께 당국 개입에 대한 경계감은 점점 높아질 것”이라며 “1480원대에서는 국민연금의 전략적 환헤지나 당국의 미세조정도 나올 가능성이 있어 급격한 환율 추가 상승은 제한될 것”이라고 짚었다."
"연초 3만원짜리 주식이 19만원까지 폭등…꿈의 바이오株 드디어 일 냈다 [K주식, 이걸 사? 말아?]","에이비엘바이오. [뉴스1]코스피 4000 시대를 맞아 그간 반도체, 방산, 조선 대비 소외를 받던 국내 제약·바이오주가 힘차게 오르고 있습니다. 대형 제약·바이오주가 모여있는 코스닥시장도 모처럼 활기를 찾은 모습입니다.이같은 제약·바이오 장세가 열릴 수 있게 된 계기는 국내 바이오벤처 기업 에이비엘바이오이 전해온 낭보 덕분입니다. 에이비엘바이오는 최근 글로벌 빅파마 일라이릴리와 최대 3조8000억원 규모의 기술이전 계약을 체결했습니다. 약물이 혈액 속으로 더 원활하게 침투할 수 있게 만들어주는 이중항체 플랫폼인 ‘그랩바디(Grabody)’가 세계적으로 인정을 받은 것인데요.덕분에 주가도 급상승했습니다. 그랩바디 기술이전 계약 체결 공시 이후 주가는 상한가로 직행했고, 그 다음날도 상한가에 육박하는 29.04%나 오르는 기염을 토했습니다. 덕분에 올초 2만9000원 선이었던 에이비엘바이오의 주가는 최고 19만5500원까지 상승했습니다. 증권가에선 에이비엘바이오의 기술력을 높게 평가하고 있는데요. 오늘은 에이비엘바이오에 대해 자세하게 알아보도록 하겠습니다.



 에이비엘바이오 주가 추이[사진 출처=네이버증권 홈페이지 갈무리]기술이전 ‘잭팟’…그랩바디 플랫폼 일 냈다14일 한국거래소에 따르면 에이비엘바이오는 전 거래일 보다 1만700원(6.54%) 상승한 17만4200원으로 장을 마감했습니다. 올초 에이비엘바이오의 주가는 2만9000원 선이었는데, 이날 장중 19만5500원까지 상승하며 역사적 신고가를 찍었습니다. 에이비엘바이오의 시가총액은 9조6028억원으로 코스닥 시총 4위를 기록하고 있습니다.2016년에 설립된 에이비엘바이오는 이중항체와 ADC 기술을 기반으로 한 면역항암제와 퇴행성뇌질환 치료제를 개발해 왔습니다. 이중항체 치료제는 단일 항체 치료제의 한계를 보완하면서 빠르게 성장하고 있습니다. 혈액암 영역에서 먼저 활용됐지만 고형암, 퇴행성뇌질환 등의 분야로 점차 그 적용 범위가 넓어지고 있죠. 에이비엘바이오는 다양한 이중항체 파이프라인을 갖고 있는데, 이들은 그랩바디 플랫폼을 기반으로 합니다.그랩바디는 크게 3가지 기술로 나뉘어집니다. 그랩바디-B는 뇌혈관장벽(BBB)을 통과할 수 있는 기술로 뇌질환 치료제 개발에 도움을 줍니다. 그랩바디-T는 면역세포의 4-1BB 와 암세포를 연결해 항암 면역반응을 강화할 수 있는 기술입니다. 마지막으로 그랩바디-I는 면역관문을 조절해 면역세포가 암세포를 공격할 수 있도록 돕습니다.



 에이비엘바이오 이중항체 플랫폼 ‘그랩바디’[사진 출처=에이비엘바이오 홈페이지 갈무리]올들어 글로벌 빅파마에 기술이전이 된 건 바로 그랩바디-B 플랫폼입니다. 지난 4월 GSK(글락소스미스클라인)와 그랩바디-B 기반으로 새로운 퇴행성뇌질환 치료제 개발을 위한 기술이전 계약을 체결했습니다. 당시 기술이전 거래 선급금은 739억원이며, 향후 신약 프로그램에 대한 개발과 허가, 상업화 마일스톤을 포함해 최대 4조1104억원을 받을 수 있게 됩니다. 이에 더해 최근엔 글로벌 제약사 시가총액 1위인 일라이릴리와 그랩바디-B 플랫폼 기술이전 계약을 체결했습니다. 이번 선급금 규모는 약 585억원이며, 향후 최대 총 3조7487억원까지 수령하게 될 것으로 예상됩니다. 이번 계약으로 일라이릴리는 그랩바디-B 플랫폼 기술을 적용한 복수의 비공개 타겟 후보물질을 개발하고 상업화할 수 있는 독점적 권리를 확보하게 됐습니다.그랩바디-B가 전세계적으로 주목받는 이유는 다양한 약물의 모달리티를 인체 곳곳에 실어 나를 수 있는 플랫폼으로 쓰일 수 있기 때문입니다. 대부분의 항체 치료제는 분자 크기가 커 뇌혈관장벽을 통과하기 어렵습니다. 하지만 그랩바디-B는 뇌세포 표면의 특정 수용체(IGF1R)를 이용해 약물을 실어 나르기 때문에 단백질이나 리보핵산 RNA 등 다양한 치료제를 안전하게 뇌 속 깊이 전달할 수 있습니다. 그랩바디-B 플랫폼이 적용된 대표적인 사례는 파킨슨병 치료제 후보 물질인 ABL301로 현재 글로벌 제약사 사노피와 에이비엘바이오가 공동 개발하고 있습니다.



 BBB 셔틀의 확장성 그림[사진 출처=에이비엘바이오, 다올투자증권]이지수 다올투자증권 연구원은 “그랩바디-B는 기존 뇌혈관장벽 셔틀 기술의 한계를 넘어 다양한 모달리티와 장기로 확장 가능한 차세대 약물전달 플랫폼으로 평가받고 있다”며 “기존 TfR1 기반 셔틀은 간, 비장 등 다른 조직에 약물이 달라붙어 효과가 떨어지는 한계가 있지만 IGF1R 기반의 그랩바디-B는 이런 비표적 결합을 최소화해 안전성과 약효 지속성을 모두 개선했다”고 평가했습니다.다양한 파이프라인 보유…“에이비엘바이오 계속 기대”에이비엘바이오는 그랩바디-B를 포함한 이중항체 플랫폼을 활용해 다양한 파이프라인을 갖추고 있습니다. ABL111은 암세포를 직접 공격하는 대신 T세포와 암세포를 연결하는 이중항체 치료 물질입니다. 즉, 우리 몸의 면역 세포인 T세포와 암세포를 연결해주는 것인데 여기엔 그랩바디-T 플랫폼 기술이 적용됩니다. 독성을 최소화하기 위해 종양세포 표면 단백질인 Claudin 18.2(클라우딘 18.2)에 T세포를 활성화하는 4-1BB 수용체를 결합하는 방식으로 작동합니다. 에이비엘바이오는 ABL11이 동물실험에서 Claudin18.2단독, 4-1BB단독, Claudin18.2와 4-1BB 병용보다 월등한 종양억제 효과를 보여주고 있고 항암효과를 보이는 동물들은 면역기억반응을 통해 동일 암세포에 대한 재발을 억제하고 있다고 설명합니다. 에이비엘바이오는 ABL111 외에도 ABL301, ABL503, ABL102, ABL104 등 다양한 파이프라인을 갖추고 있다.



 ABL111의 구조와 작용 기전[사진 출처=에이비엘바이오 홈페이지]증권가 안팎에선 에이비엘바이오의 가치를 높게 평가합니다. 향후 다양한 기술수출 기회가 열릴 것이라고 예상되기 때문이다. 국내 증권사들이 제시한 에이비엘바이오의 목표주가는 △교보증권 19만원 △메리츠증권 18만원 △다올투자증권 16만원 △키움증권 18만원 등입니다. 허혜민 키움증권 연구원은 “뇌혈관장벽 투과 기술 보유로 항체 외에도 RNA 영역까지 모달리티가 확장되고 있다는 게 긍정적”이라며 “향후 예상 가능한 데이터 모멘텀으로는 CTX-009 3상, ABL111 1상으로, 내년 상반기 발표할 수 있을 것으로 보인다”고 했다.이해진 임플바이오리서치 대표도 저서 ‘5년 후 10배 오를 바이오 기업에 투자하라’에서 “ABL001은 2027년 상업화에 따른 의미 있는 규모의 현금 유입이 발생할 수 있다”며 “최초 담도암 2차치료제로서 시장에 진입하는 만큼 에이비엘바이오는 천억 단위의 자금 유입이 가능할 것으로 기대하고 있다”고 했습니다. 이어 “긍정적인 임상결과 발표, 이중항체 ADC 개발의 순조로운 진행, 빅파마 외에 다른 글로벌 제약사와 기술이전 계약이 이어진다면 시장의 신뢰를 받으며 주가 역시 한 단계 레벨업할 것”이라고 예상했습니다.



 이 기사를 정리하며 ‘5년 후 10배 오를 바이오 기업에 투자하라’ 도서를 참고했음을 밝힙니다. 사진은 책 표지[사진 출처=교보문고 홈페이지 갈무리]고환율, 정치적 혼란 등으로 국내 증시가 휘청이고 있습니다. 갈 곳 잃은 투자자들이 넘쳐났고 미국 증시로의 투자 이민자들도 늘어났습니다. 하지만 K증시 한편에서 묵묵히 실적을 내면서 주가가 폭발적으로 올라가는 종목들도 있습니다. 국내 투자자들에게 희망과 꿈이 될 수 있도록 차세대 주도주를 발굴하고 좋은 우량주를 꼼꼼히 분석해 드리겠습니다."
엔비디아 실적·美 고용보고서 주목…코스피 3900~4250 [주간 증시 전망],"엔비디아 실적, AI 거품론 잠재울까셧다운 여파로 10월 고용지표 공백9월 고용보고서 주목도 높아지나자사주 소각 등 韓 정책 모멘텀도 주목



이번주 국내 증시는 인공지능(AI) 대장주 엔비디아의 실적 발표와 미국 고용보고서, 국내 정책 모멘텀 등에 영향을 받을 전망이다. 증권업계는 이번주 코스피 지수 밴드로 3900~4250선을 제시했다. ⓒ데일리안[데일리안 = 강현태 기자] 이번주 국내 증시는 인공지능(AI) 대장주 엔비디아의 실적 발표와 미국 고용보고서, 국내 정책 모멘텀 등에 영향을 받을 전망이다. 증권업계는 이번주 코스피 지수 밴드로 3900~4250선을 제시했다.16일 한국거래소에 따르면, 지난 14일 코스피 지수는 전 거래일보다 159.06포인트(3.81%) 내린 4011.57에 장을 마쳤다.지난주(11월 10~14일) 코스피 지수는 3984.24~4188.54포인트 사이에서 움직였다. 정부·여당의 배당소득 분리과세 완화, 미국 연방정부 셧다운(일부 업무중지) 해제 기대감 등에 힘입어 4거래일 연속 우상향했지만, 셧다운 후유증 우려가 커진 금요일엔 급락 마감했다.이번주 증시는 엔비디아 등 주요기업 실적, 셧다운 여파로 공개되지 않았던 지난 9월 미 고용보고서, 한국 정책 모멘텀 등에 영향을 받을 전망이다.무엇보다 인공지능(AI) 거품론이 사그라들지 않는 상황에서 엔비디아 실적 및 가이던스가 시장 기대를 충족할 수 있을지 주목된다.정해창 대신증권 연구원은 ""한국 시각으로 오는 20일 새벽 엔비디아 실적 발표가 핵심 이벤트""라며 ""지난 분기 실적도 중요하지만, 블랙웰 등 AI 칩에 대한 전방 수요, 수익화 경로와 향후 실적 가이던스 등이 최근 AI 거품론과 시장 조정 향방을 결정지을 것""이라고 말했다.▼ 관련기사 보기코스피에 못미친 코스닥 상승률…투자전략은https://www.dailian.co.kr/news/view/1572364외국인, 6개월 연속 韓주식 순매수…지난달 4.2조원 사들여https://www.dailian.co.kr/news/view/1573085미국 연방정부가 오는 20일(현지시각) 공개하는 9월 고용보고서도 주목할 필요가 있다. 김유미 키움증권 연구원은 ""10월 고용보고서는 실업률 없이 발표될 수 있다는 보도가 이어지는 등 당분간 주요 지표 신뢰성 저하는 불가피해 보인다""면서도 ""9월 고용보고서는 노동시장 흐름을 가늠할 수 있는 중요한 지표가 될 전망이다. 비농가 신규고용 둔화 시 12월 금리인하 기대가 다시 높아질 가능성도 있다""고 말했다.금리인하 관련 연준 내부 분위기를 파악할 수 있는 10월 연방공개시장위원회(FOMC) 회의록 내용도 눈여겨봐야 한다.정 연구원은 ""회의록을 통해 내부 의견 차이를 확인할 수 있을 것""이라며 ""셧다운 사태로 10월 경제지표 발표 누락이 예상돼 주요 데이터 없이 정책 결정이 이뤄질 수 있는 상황에서 연준 위원들의 생각과 판단이 더욱 중요해질 전망""이라고 밝혔다.국내 변수와 관련해선 정책 모멘텀이 증시에 영향을 줄 가능성이 높다.나정환 NH투자증권 연구원은 ""자사주 소각 의무화 논의가 구체화될 가능성이 있다""며 ""여당 코스피 5000특위는 기존 자사주까지 1년 내 소각하도록 하는 개정안을 발의할 예정이다. 자사주가 많은 금융주와 지주사, 성장산업 내 중소형주에 관심을 가질 필요가 있다""고 밝혔다."
"불성실공시법인 지정, 지난해보다 줄었지만…코스닥 중심 ‘질적 문제’ 여전 [투자360]","3년 중 최저 건수…양적 감소에도 ‘질적 리스크’ 고착코스닥 법인 지정 건수, 코스피 두 배 수준상장폐지 위험도…벌점 30점 이상 기업 속출



14일 오전 서울 중구 하나은행 딜링룸 전광판에 환율과 코스닥 지수 등이 표시되어 있다. 이상섭 기자[헤럴드경제=경예은 기자] 올해 불성실공시법인 지정 건수가 지난해보다 줄어든 것으로 나타났으나 코스닥을 중심으로 ‘질적 위반’은 여전히 개선되지 않은 것으로 분석됐다. 공시번복, 공시 불이행 등 기본적 공시의무 위반이 거듭되면서 시장 신뢰를 훼손하고 있다는 지적이다.16일 한국거래소에 따르면 올해 연초부터 지난 13일까지 불성실공시법인 지정 건수는 118건으로, 지난해 같은 기간(140건) 대비 감소했다. 연간 기준으로도 지난해(158건)와 2023년(121건)보다 적어 최근 3년 가운데 가장 낮았다.그러나 공시 위반의 질적 문제는 크게 개선되지 않은 모습이다. 지정사유를 보면 유상증자 결정 철회, 전환사채(CB) 발행 결정 철회, 신주인수권부사채권(BW) 발행 철회 등 자금조달 관련 번복 사례가 다수였다. 단일판매·공급계약 체결·해지의 지연공시, 계약금액 50% 이상 변경 등 계약 관련 불성실공시도 빈번했다.최대주주 변경을 수반하는 주식 담보제공 계약 미공시, 주식양수도 계약 체결 지연공시, 경영권 변경 관련 계약 해제 등 지배구조 변동 공시 위반도 꾸준히 적발됐다. 소송 제기·판결 지연공시, 횡령·배임 사실 지연공시, 감사보고서 제출 지연 등 회사 핵심 정보 공시 지연도 적지 않았다.특히 코스닥 시장에서만 불성실공시 법인 지정이 74건에 달해 전체의 60% 이상을 차지했다. 유상증자 철회와 CB 발행 철회가 반복되며 투자자 혼란을 키운 만큼, 양적 감소에도 불구하고 코스닥 중심의 구조적 문제는 여전히 심각하다는 지적이 나온다.누적 벌점 규모도 심상찮다. 한국유니온제약, 코아스, 올리패스 등 일부 종목은 벌점 30점 이상을 웃돌아 상장폐지 리스크가 불거졌다. 현행 코스닥시장 상장규정 제56조는 최근 1년간 누계 벌점이 15점 이상이면 상장적격성 실질심사를 받도록 하고 있다. 누계 30점을 기록한 올리패스는 지난달 15일 결국 상장폐지가 확정됐다.유가증권시장에서도 공시의무 위반 사례가 잇따랐다. KCC는 지난달 31일 공시번복으로 제재금 800만원을 부과받았고, 아이에스동서 역시 공시불이행으로 벌점 2점을 받았다. 포스코DX, 한진 등 대형주에서도 지연공시가 적발됐다.시장 전문가들은 코스닥의 구조적 요인을 이유로 들었다. 이준서 동국대 경영학과 교수는 “코스닥은 상장사 수가 코스피의 두 배에 달하는 데다가 적자를 이어가는 기업들이 본질적 가치 개선보다는 상장폐지 회피나 단기 주가 부양에 기댄 공시를 반복하는 경향이 있다”고 꼬집었다. 유상증자 역시 운용자금 보전 목적이 적지 않아 시장 내에서 부정적 신호로 받아들여지고, 이 과정에서 결정과 철회가 찾아 투자자 혼란을 키우는 측면이 있다는 지적이다.아울러 “올해 코스피와 코스닥 양 시장 간 격차가 역사상 가장 크게 벌어졌다”며 “코스닥 상장·공시 심사를 강화하는 동시에 기술특례 상장 제도 재검토와 코넥스와의 통합 등 거래소 구조 개편을 통해 ‘2부리그’가 아닌 코스피와 병렬적으로 경쟁하는 시장으로 체질을 바꿔야 한다”고 조언했다."
에이비엘바이오 훈풍에…소외됐던 바이오주 부상[펀드와치],"AI 거품론에 반도체주 약세 속 바이오주 부각기술수출 훈풍에 바이오섹터 전반 투심 개선[이데일리 원다연 기자] 국내 증시 강세 속에서 소외돼 있던 제약·바이오 업종이 부상하고 있다. 인공지능(AI) 대형주의 고평가 논란에 증시를 이끌어 온 반도체주 약세가 약세를 보이며 바이오주로 순환매가 나타나면서 지난주 펀드 시장에서도 바이오 테마 펀드가 두드러진 성과를 냈다. 16일 펀드평가사 KG제로인에 따르면 순자산액(클래스 합산) 100억원 이상, 운용 기간 1개월 이상인 국내 주식형 펀드 가운데 지난주 가장 높은 수익률을 기록한 상품은 삼성액티브자산운용의 ‘KoAct 바이오헬스케어액티브’ 상장지수펀드(ETF)로, 12.98%의 수익률을 냈다. KoAct 바이오헬스케어액티브는 차세대 바이오헬스케어 핵심 기업에 투자하는 상품으로, 에이비엘바이오(298380), 알테오젠(196170), 리가켐바이오(141080), 올릭스(226950), 한미약품(128940) 등의 순으로 투자 비중이 높다. 에이비엘바이오의 기술 수출 훈풍에 주요 바이오 종목의 주가가 같이 뛰며 펀드 수익률 상승을 뒷받침했다. 에이비엘바이오는 지난 12일 일라이 릴리와 신약 개발을 위한 ‘그랩바디’ 플랫폼 기술이전 및 공동 연구개발 계약을 체결했다고 밝힌 뒤 3거래일 동안 65.53% 급등했다.정이수 IBK투자증권 연구원은 “미국발 의약품 관세 리스크가 상당 부분 완화된 가운데 에이비엘바이오의 대규모 기술이전 계약을 계기로 투자심리가 개선되며 바이오 섹터의 긍정적인 흐름이 이어질 전망”이라고 밝혔다. KoAct 바이오헬스케어액티브 ETF에 이어 미래에셋자산운용의 ‘미래에셋연금한국헬스케어’ 펀드(11.08%), DB자산운용의 ‘바이오헬스케어’ 펀드(10.64%), 타임폴리오자산운용의 ‘TIMEFOLIO 바이오액티브’ ETF(10.07%) 등의 바이오 테마 펀드가 일제히 수익률 상위권에 이름을 올렸다. 같은 기간 전체 국내 주식형 펀드의 평균 수익률은 3.45%를 기록했다. 지난주 코스피 지수는 주중 상승세를 이어가다 마지막 거래일인 14일 AI주 고평가 우려와 미국 중앙은행의 금리 동결 전망을 반영하며 급락했다. 해외 주식형 펀드의 주간 평균 수익률은 0.98%을 기록했다. 지역별로 남미신흥국 주식의 상승폭(4.37%)이 가장 컸고, 유럽신흥국 주식의 성과(0.80%)가 가장 부진했다. 섹터별로는 기초소재 섹터가 9.56%로 두드러지는 성과를 냈고, 에너지 섹터는 1.02% 하락했다. 개별 상품 중에선 NH-아문디자산운용의 ‘HANARO 글로벌금채굴기업’ ETF가 13.61%로 가장 높은 수익률을 냈다. 자금 흐름을 살펴보면 주식형 펀드의 설정액은 223억원 증가한 17조 1916억원으로 집계됐다. 채권형 펀드의 설정액은 2조 1921억원 감소한 49조 6072억원, 머니마켓펀드(MMF)의 설정액은 3조 591억원 증가한 163조 3770억원으로 집계됐다.



코스피가 뉴욕증시 급락 여파로 3% 이상 하락한 14일 서울 중구 하나은행 본점 딜링룸 현황판에 코스피 지수가 표시돼 있다. (사진=연합뉴스)"
